{
  "$schema": "../../chain.schema.json",
  "name": "shentu",
  "chainName": "Shentu",
  "logo_URIs": {
    "png": "https://raw.githubusercontent.com/cosmos/chain-registry/master/shentu/images/ctk.png",
    "svg": "https://raw.githubusercontent.com/cosmos/chain-registry/master/shentu/images/ctk.svg"
  },
  "rpcUrl": "https://rpc.cosmos.directory/shentu",
  "restUrl": "https://rest.cosmos.directory/shentu",
  "chainId": "shentu-2.2",
  "bech32": "shentu",
  "denom": "ctk",
  "denomUpper": "CTK",
  "sdenom": "uctk",
  "coinType": 118,
  "gasPriceStep": {
    "low": 0.025,
    "average": 0.025,
    "high": 0.025
  },
  "coinDecimals": 6,
  "features": [],
  "coinGeckoId": "certik",
  "chainInfo": {
    "cosmosSdkVersion": "0.47.10",
    "ibcGoVersion": "7.4.0"
  },
  "colors": {
    "primaryOnLight": "#e1aa4c",
    "primaryOnDark": "#e1aa4c",
    "lighterOnLight": "#f8f2e9",
    "lighterOnDark": "#f8f2e9",
    "darkerOnLight": "#e1aa4c",
    "darkerOnDark": "#e1aa4c"
  },
  "links": [
    {
      "title": "Official Website",
      "url": "https://shentu.technology",
      "icon": {
        "svg": "web"
      }
    },
    {
      "title": "GitHub",
      "url": "https://github.com/ShentuChain",
      "icon": {
        "svg": "github"
      }
    },
    {
      "title": "Medium",
      "url": "https://medium.com/shentu-foundation",
      "icon": {
        "svg": "medium"
      }
    },
    {
      "title": "Learn more",
      "icon": {
        "svg": "dotsHorizontal"
      },
      "children": [
        {
          "title": "Twitter",
          "url": "https://twitter.com/ShentuChain",
          "icon": {
            "svg": "twitter"
          }
        },
        {
          "title": "Discord",
          "url": "https://discord.com/invite/7D62sHx6aZ",
          "icon": {
            "svg": "discord"
          }
        }
      ]
    }
  ],
  "isExplorerEnabled": true,
  "isModuleEnabled": {
    "governance": true
  },
  "isNativelySupportedByKeplr": true,
  "withCoingeckoApi": false,
  "isFeatured": false
}
