{
  "$schema": "../../chain.schema.json",
  "name": "irisnet",
  "chainName": "IRISnet",
  "logo_URIs": {
    "png": "https://raw.githubusercontent.com/cosmos/chain-registry/master/irisnet/images/iris.png",
    "svg": "https://raw.githubusercontent.com/cosmos/chain-registry/master/irisnet/images/iris.svg"
  },
  "rpcUrl": "https://rpc.irishub-1.irisnet.org",
  "restUrl": "https://api.irishub-1.irisnet.org",
  "chainId": "irishub-1",
  "denom": "iris",
  "denomUpper": "IRIS",
  "sdenom": "uiris",
  "bech32PrefixAcc": "iaa",
  "bech32PrefixVal": "iva",
  "coinType": 118,
  "gasPriceStep": {
    "low": 0.0025,
    "average": 0.0025,
    "high": 0.0025
  },
  "coinDecimals": 6,
  "features": [],
  "coinGeckoId": "iris-network",
  "chainInfo": {
    "cosmosSdkVersion": "0.47.4",
    "ibcGoVersion": "7.3.0"
  },
  "colors": {
    "primaryOnLight": "#0492dc",
    "primaryOnDark": "#0492dc",
    "darkerOnLight": "#0492dc",
    "darkerOnDark": "#0492dc",
    "lighterOnLight": "#e0f2fb",
    "lighterOnDark": "#e0f2fb"
  },
  "links": [
    {
      "title": "Official Website",
      "url": "https://www.irisnet.org",
      "icon": {
        "svg": "web"
      }
    },
    {
      "title": "Docs",
      "url": "https://www.irisnet.org/docs",
      "icon": {
        "svg": "document"
      }
    },
    {
      "title": "GitHub",
      "url": "https://github.com/irisnet",
      "icon": {
        "svg": "github"
      }
    },
    {
      "title": "Learn more",
      "icon": {
        "svg": "dotsHorizontal"
      },
      "children": [
        {
          "title": "Medium",
          "url": "https://medium.com/irisnet-blog",
          "icon": {
            "svg": "medium"
          }
        },
        {
          "title": "Twitter",
          "url": "https://twitter.com/irisnetwork",
          "icon": {
            "svg": "twitter"
          }
        }
      ]
    }
  ],
  "isExplorerEnabled": true,
  "isModuleEnabled": {
    "governance": true
  },
  "isNativelySupportedByKeplr": true,
  "withCoingeckoApi": true,
  "isFeatured": true
}
