{
  "$schema": "../../chain.schema.json",
  "name": "noble",
  "chainName": "Noble",
  "logo_URIs": {
    "png": "https://raw.githubusercontent.com/cosmos/chain-registry/master/noble/images/stake.png",
    "svg": "https://raw.githubusercontent.com/cosmos/chain-registry/master/noble/images/stake.svg"
  },
  "rpcUrl": "https://rpc.cosmos.directory/noble",
  "restUrl": "https://rest.cosmos.directory/noble",
  "chainId": "noble-1",
  "bech32": "noble",
  "denom": "stake",
  "denomUpper": "STAKE",
  "sdenom": "ustake",
  "coinType": 118,
  "coinDecimals": 6,
  "features": [
    "ibc-transfer"
  ],
  "coinGeckoId": "",
  "gasPriceStep": {
    "low": 0.1,
    "average": 0.1,
    "high": 0.2
  },
  "chainInfo": {
    "cosmosSdkVersion": "0.45.16",
    "ibcGoVersion": "4.5.1"
  },
  "colors": {
    "primaryOnLight": "#6A8AF8",
    "primaryOnDark": "#6A8AF8",
    "lighterOnLight": "#6A8AF8",
    "lighterOnDark": "#6A8AF8",
    "darkerOnLight": "#6A8AF8",
    "darkerOnDark": "#6A8AF8"
  },
  "links": [
    {
      "title": "Official Website",
      "url": "https://nobleassets.xyz/",
      "icon": {
        "svg": "web"
      }
    },
    {
      "title": "Twitter",
      "url": "https://twitter.com/noble_xyz",
      "icon": {
        "svg": "twitter"
      }
    },
    {
      "title": "GitHub",
      "url": "https://github.com/strangelove-ventures/noble",
      "icon": {
        "svg": "github"
      }
    },
    {
      "title": "Learn more",
      "icon": {
        "svg": "dotsHorizontal"
      },
      "children": [
        {
          "title": "Medium",
          "url": "https://mirror.xyz/nobleassets.eth",
          "icon": {
            "svg": "medium"
          }
        }
      ]
    }
  ],
  "isExplorerEnabled": true,
  "isModuleEnabled": {
    "governance": false
  },
  "isNativelySupportedByKeplr": true,
  "withCoingeckoApi": false,
  "isFeatured": false
}
