{
  "$schema": "../../chain.schema.json",
  "name": "kichain",
  "chainName": "KiChain",
  "logo_URIs": {
    "png": "https://raw.githubusercontent.com/cosmos/chain-registry/master/kichain/images/xki.png",
    "svg": "https://raw.githubusercontent.com/cosmos/chain-registry/master/kichain/images/xki.svg"
  },
  "rpcUrl": "https://rpc-mainnet.blockchain.ki",
  "restUrl": "https://api-mainnet.blockchain.ki",
  "chainId": "kichain-2",
  "denom": "xki",
  "denomUpper": "XKI",
  "sdenom": "uxki",
  "bech32": "ki",
  "coinType": 118,
  "gasPriceStep": {
    "low": 0.025,
    "average": 0.025,
    "high": 0.025
  },
  "coinDecimals": 6,
  "features": [
    "ibc-transfer",
    "cosmwasm"
  ],
  "coinGeckoId": "ki",
  "chainInfo": {
    "cosmosSdkVersion": "0.45.12",
    "ibcGoVersion": "3.3.1"
  },
  "colors": {
    "primaryOnLight": "#3756fc",
    "primaryOnDark": "#3756fc",
    "lighterOnLight": "#eaeaea",
    "lighterOnDark": "#eaeaea",
    "darkerOnLight": "#3756fc",
    "darkerOnDark": "#3756fc"
  },
  "links": [
    {
      "title": "Official Website",
      "url": "https://foundation.ki",
      "icon": {
        "svg": "web"
      }
    },
    {
      "title": "DApp",
      "icon": {
        "svg": "apps"
      },
      "children": [
        {
          "title": "Cosmon",
          "url": "https://cosmon.ki/",
          "icon": {
            "svgImg": "dapp/cosmon"
          }
        }
      ]
    },
    {
      "title": "GitHub",
      "url": "https://github.com/KiFoundation",
      "icon": {
        "svg": "github"
      }
    },
    {
      "title": "Learn more",
      "icon": {
        "svg": "dotsHorizontal"
      },
      "children": [
        {
          "title": "Medium",
          "url": "https://medium.com/ki-foundation",
          "icon": {
            "svg": "medium"
          }
        },
        {
          "title": "Twitter",
          "url": "https://twitter.com/Ki_Foundation",
          "icon": {
            "svg": "twitter"
          }
        }
      ]
    }
  ],
  "isExplorerEnabled": true,
  "isModuleEnabled": {
    "governance": true
  },
  "isNativelySupportedByKeplr": false,
  "withCoingeckoApi": true,
  "isFeatured": true
}
