{
  "$schema": "../../chain.schema.json",
  "name": "nois",
  "chainName": "Nois",
  "logo_URIs": {
    "png": "https://raw.githubusercontent.com/cosmos/chain-registry/master/nois/images/nois.png"
  },
  "rpcUrl": "https://rpc-nois.ezstaking.dev",
  "restUrl": "https://lcd-nois.ezstaking.dev",
  "chainId": "nois-1",
  "bech32": "nois",
  "denom": "nois",
  "denomUpper": "NOIS",
  "sdenom": "unois",
  "coinType": 118,
  "gasPriceStep": {
    "low": 0.05,
    "average": 0.08,
    "high": 0.1
  },
  "coinDecimals": 6,
  "features": [
    "ibc-transfer",
    "ibc-go",
    "cosmwasm",
    "wasmd_0.24+"
  ],
  "coinGeckoId": "",
  "assets": [
    {
      "base": "unois",
      "coingecko_id": null,
      "denom_units": [
        {
          "denom": "unois",
          "exponent": 0
        },
        {
          "denom": "nois",
          "exponent": 6
        }
      ],
      "description": "The native staking and governance token of the Nois Network.",
      "display": "nois",
      "logo_URIs": {
        "png": "https://raw.githubusercontent.com/cosmos/chain-registry/master/nois/images/nois.png"
      },
      "name": "NOIS",
      "symbol": "NOIS"
    }
  ],
  "chainInfo": {
    "cosmosSdkVersion": "0.45.14",
    "ibcGoVersion": "4.3.0"
  },
  "colors": {
    "primaryOnLight": "#0B0914",
    "primaryOnDark": "#e5e7eb",
    "lighterOnLight": "#e5e7eb",
    "lighterOnDark": "#e5e7eb",
    "darkerOnLight": "#161130",
    "darkerOnDark": "#161130"
  },
  "links": [
    {
      "title": "Official Website",
      "url": "https://nois.network",
      "icon": {
        "svg": "web"
      }
    },
    {
      "title": "Docs",
      "url": "https://docs.nois.network",
      "icon": {
        "svg": "document"
      }
    },
    {
      "title": "GitHub",
      "url": "https://github.com/noislabs",
      "icon": {
        "svg": "github"
      }
    },
    {
      "title": "Learn more",
      "icon": {
        "svg": "dotsHorizontal"
      },
      "children": [
        {
          "title": "Twitter",
          "url": "https://twitter.com/NoisNetwork",
          "icon": {
            "svg": "twitter"
          }
        },
        {
          "title": "Discord",
          "url": "https://chat.nois.network",
          "icon": {
            "svg": "discord"
          }
        }
      ]
    }
  ],
  "isExplorerEnabled": true,
  "isModuleEnabled": {
    "governance": true
  },
  "isNativelySupportedByKeplr": false,
  "withCoingeckoApi": true,
  "isFeatured": true
}
