{
  "$schema": "../../chain.schema.json",
  "name": "persistence",
  "chainName": "Persistence",
  "logo_URIs": {
    "png": "https://raw.githubusercontent.com/cosmos/chain-registry/master/persistence/images/xprt.png",
    "svg": "https://raw.githubusercontent.com/cosmos/chain-registry/master/persistence/images/xprt.svg"
  },
  "rpcUrl": "https://rpc.core.persistence.one",
  "restUrl": "https://rest.core.persistence.one",
  "chainId": "core-1",
  "bech32": "persistence",
  "denom": "xprt",
  "denomUpper": "XPRT",
  "sdenom": "uxprt",
  "coinType": 118,
  "coinDecimals": 6,
  "features": [
    "ibc-transfer"
  ],
  "coinGeckoId": "persistence",
  "gasPriceStep": {
    "low": 0,
    "average": 0.025,
    "high": 0.04
  },
  "chainInfo": {
    "cosmosSdkVersion": "ersistenceOne/cosmos-sdk v0.47.10-lsm-rc0",
    "ibcGoVersion": "7.4.0"
  },
  "colors": {
    "primaryOnLight": "#e50a13",
    "primaryOnDark": "#e50a13",
    "lighterOnLight": "#e50a13",
    "lighterOnDark": "#e50a13",
    "darkerOnLight": "#e50a13",
    "darkerOnDark": "#e50a13"
  },
  "links": [
    {
      "title": "Official Website",
      "url": "https://persistence.one/",
      "icon": {
        "svg": "web"
      }
    },
    {
      "title": "Twitter",
      "url": "https://twitter.com/PersistenceOne",
      "icon": {
        "svg": "twitter"
      }
    },
    {
      "title": "GitHub",
      "url": "https://github.com/persistenceOne",
      "icon": {
        "svg": "github"
      }
    },
    {
      "title": "Learn more",
      "icon": {
        "svg": "dotsHorizontal"
      },
      "children": [
        {
          "title": "Medium",
          "url": "https://blog.persistence.one/",
          "icon": {
            "svg": "medium"
          }
        }
      ]
    }
  ],
  "isExplorerEnabled": true,
  "isModuleEnabled": {
    "governance": true
  },
  "isNativelySupportedByKeplr": true,
  "withCoingeckoApi": false,
  "isFeatured": false
}
