{
  "$schema": "../../chain.schema.json",
  "name": "bitsong",
  "chainName": "BitSong",
  "logo_URIs": {
    "png": "https://raw.githubusercontent.com/cosmos/chain-registry/master/bitsong/images/btsg.png",
    "svg": "https://raw.githubusercontent.com/cosmos/chain-registry/master/bitsong/images/btsg.svg"
  },
  "rpcUrl": "https://rpc.explorebitsong.com",
  "restUrl": "https://lcd.explorebitsong.com",
  "chainId": "bitsong-2b",
  "bech32": "bitsong",
  "denom": "btsg",
  "denomUpper": "BTSG",
  "sdenom": "ubtsg",
  "coinType": 639,
  "gasPriceStep": {
    "low": 0.015,
    "average": 0.015,
    "high": 0.015
  },
  "coinDecimals": 6,
  "features": ["ibc-transfer", "ibc-go", "cosmwasm", "wasmd_0.24+"],
  "coinGeckoId": "bitsong",
  "chainInfo": {
    "cosmosSdkVersion": "0.45.16",
    "ibcGoVersion": "3.3.1"
  },
  "colors": {
    "primaryOnLight": "#ff005c",
    "primaryOnDark": "#ff005c",
    "lighterOnLight": "#fbe9f1",
    "lighterOnDark": "#fbe9f1",
    "darkerOnLight": "#201a5e",
    "darkerOnDark": "#201a5e"
  },
  "links": [
    {
      "title": "Official Website",
      "url": "https://bitsong.io",
      "icon": {
        "svg": "web"
      }
    },
    {
      "title": "BitSong Music Player",
      "url": "https://play.bitsong.io",
      "icon": {
        "svg": "apps"
      }
    },
    {
      "title": "Docs",
      "url": "https://docs.bitsong.io",
      "icon": {
        "svg": "document"
      }
    },
    {
      "title": "Learn more",
      "icon": {
        "svg": "dotsHorizontal"
      },
      "children": [
        {
          "title": "GitHub",
          "url": "https://github.com/bitsongofficial",
          "icon": {
            "svg": "github"
          }
        },
        {
          "title": "Medium",
          "url": "https://bitsongofficial.medium.com",
          "icon": {
            "svg": "medium"
          }
        },
        {
          "title": "Twitter",
          "url": "https://twitter.com/bitsongofficial",
          "icon": {
            "svg": "twitter"
          }
        }
      ]
    }
  ],
  "isExplorerEnabled": true,
  "isModuleEnabled": {
    "governance": true
  },
  "isNativelySupportedByKeplr": false,
  "withCoingeckoApi": false,
  "isFeatured": false
}
