{
  "$schema": "../../chain.schema.json",
  "name": "emoney",
  "chainName": "e-Money",
  "logo_URIs": {
    "png": "https://raw.githubusercontent.com/cosmos/chain-registry/master/emoney/images/ngm.png",
    "svg": "https://raw.githubusercontent.com/cosmos/chain-registry/master/emoney/images/ngm.svg"
  },
  "rpcUrl": "https://emoney.validator.network",
  "restUrl": "https://emoney.validator.network/api",
  "chainId": "emoney-3",
  "bech32": "emoney",
  "denom": "ngm",
  "denomUpper": "NGM",
  "sdenom": "ungm",
  "coinType": 118,
  "gasPriceStep": {
    "low": 0.025,
    "average": 0.025,
    "high": 0.025
  },
  "coinDecimals": 6,
  "features": [
    "ibc-transfer"
  ],
  "coinGeckoId": "e-money",
  "chainInfo": {
    "cosmosSdkVersion": "0.42.11",
    "ibcGoVersion": "3.0.0"
  },
  "colors": {
    "primaryOnLight": "#035059",
    "primaryOnDark": "#035059",
    "lighterOnLight": "#86ccba",
    "lighterOnDark": "#86ccba",
    "darkerOnLight": "#00282d",
    "darkerOnDark": "#00282d"
  },
  "links": [
    {
      "title": "Official Website",
      "url": "https://e-money.com",
      "icon": {
        "svg": "web"
      }
    },
    {
      "title": "e-Money Wallet",
      "url": "https://app.e-money.com",
      "icon": {
        "svg": "apps"
      }
    },
    {
      "title": "GitHub",
      "url": "https://github.com/e-money",
      "icon": {
        "svg": "github"
      }
    },
    {
      "title": "Learn more",
      "icon": {
        "svg": "dotsHorizontal"
      },
      "children": [
        {
          "title": "Medium",
          "url": "https://medium.com/e-money-com",
          "icon": {
            "svg": "medium"
          }
        },
        {
          "title": "Twitter",
          "url": "https://twitter.com/emoney_com",
          "icon": {
            "svg": "twitter"
          }
        }
      ]
    }
  ],
  "isExplorerEnabled": true,
  "isModuleEnabled": {
    "governance": false
  },
  "isNativelySupportedByKeplr": false,
  "withCoingeckoApi": false,
  "isFeatured": false
}
