{
  "$schema": "../../chain.schema.json",
  "name": "assetmantle",
  "chainName": "AssetMantle",
  "logo_URIs": {
    "png": "https://raw.githubusercontent.com/cosmos/chain-registry/master/assetmantle/images/AM_Logo.png",
    "svg": "https://raw.githubusercontent.com/cosmos/chain-registry/master/assetmantle/images/AM_Logo_Dark.svg"
  },
  "rpcUrl": "https://rpc-assetmantle.ezstaking.dev",
  "restUrl": "https://lcd-assetmantle.ezstaking.dev",
  "chainId": "mantle-1",
  "bech32": "mantle",
  "denom": "mntl",
  "denomUpper": "MNTL",
  "sdenom": "umntl",
  "coinType": 118,
  "gasPriceStep": {
    "low": 0,
    "average": 0,
    "high": 0
  },
  "coinDecimals": 6,
  "features": ["ibc-transfer"],
  "coinGeckoId": "assetmantle",
  "chainInfo": {
    "cosmosSdkVersion": "0.45.16",
    "ibcGoVersion": "4.4.2"
  },
  "colors": {
    "primaryOnLight": "#f3b519",
    "primaryOnDark": "#f3b519",
    "lighterOnLight": "#f6f3e9",
    "lighterOnDark": "#f6f3e9",
    "darkerOnLight": "#f6f3e9",
    "darkerOnDark": "#f6f3e9"
  },
  "links": [
    {
      "title": "Official Website",
      "url": "https://assetmantle.one",
      "icon": {
        "svg": "web"
      }
    },
    {
      "title": "Docs",
      "url": "https://docs.assetmantle.one",
      "icon": {
        "svg": "document"
      }
    },
    {
      "title": "GitHub",
      "url": "https://github.com/AssetMantle",
      "icon": {
        "svg": "github"
      }
    },
    {
      "title": "Learn more",
      "icon": {
        "svg": "dotsHorizontal"
      },
      "children": [
        {
          "title": "Medium",
          "url": "https://blog.assetmantle.one",
          "icon": {
            "svg": "medium"
          }
        },
        {
          "title": "Twitter",
          "url": "https://twitter.com/AssetMantle",
          "icon": {
            "svg": "twitter"
          }
        }
      ]
    }
  ],
  "isExplorerEnabled": true,
  "isModuleEnabled": {
    "governance": true
  },
  "isNativelySupportedByKeplr": false,
  "withCoingeckoApi": true,
  "isFeatured": true
}
