{
  "$schema": "../../chain.schema.json",
  "name": "chihuahua",
  "chainName": "Chihuahua",
  "logo_URIs": {
    "png": "https://raw.githubusercontent.com/cosmos/chain-registry/master/chihuahua/images/huahua.png",
    "svg": "https://raw.githubusercontent.com/cosmos/chain-registry/master/chihuahua/images/huahua.svg"
  },
  "rpcUrl": "https://rpc.chihuahua.wtf",
  "restUrl": "https://api.chihuahua.wtf",
  "chainId": "chihuahua-1",
  "denom": "huahua",
  "denomUpper": "HUAHUA",
  "bech32": "chihuahua",
  "sdenom": "uhuahua",
  "coinType": 118,
  "gasPriceStep": {
    "low": 0.0025,
    "average": 0.0025,
    "high": 0.0025
  },
  "coinDecimals": 6,
  "features": [
    "ibc-transfer",
    "ibc-go",
    "cosmwasm",
    "wasmd_0.24+"
  ],
  "coinGeckoId": "chihuahua-token",
  "chainInfo": {
    "cosmosSdkVersion": "0.47.5",
    "ibcGoVersion": "7.3.0"
  },
  "colors": {
    "primaryOnLight": "#f4b330",
    "primaryOnDark": "#f4b330",
    "lighterOnLight": "#f1f1f2",
    "lighterOnDark": "#f1f1f2",
    "darkerOnLight": "#f4b330",
    "darkerOnDark": "#f4b330"
  },
  "links": [
    {
      "title": "Official Website",
      "url": "https://www.chihuahua.wtf",
      "icon": {
        "svg": "web"
      }
    },
    {
      "title": "Docs",
      "url": "https://github.com/ChihuahuaChain/mainnet",
      "icon": {
        "svg": "document"
      }
    },
    {
      "title": "GitHub",
      "url": "https://github.com/ChihuahuaChain/mainnet",
      "icon": {
        "svg": "github"
      }
    },
    {
      "title": "Learn more",
      "icon": {
        "svg": "dotsHorizontal"
      },
      "children": [
        {
          "title": "Medium",
          "url": "https://chihuahuachain.medium.com",
          "icon": {
            "svg": "medium"
          }
        },
        {
          "title": "Twitter",
          "url": "https://twitter.com/ChihuahuaChain",
          "icon": {
            "svg": "twitter"
          }
        }
      ]
    }
  ],
  "isExplorerEnabled": true,
  "isModuleEnabled": {
    "governance": true
  },
  "isNativelySupportedByKeplr": true,
  "withCoingeckoApi": false,
  "isFeatured": false
}
