{
  "$schema": "../../chain.schema.json",
  "name": "stride",
  "chainName": "Stride",
  "logo_URIs": {
    "png": "https://raw.githubusercontent.com/cosmos/chain-registry/master/stride/images/strd.png",
    "svg": "https://raw.githubusercontent.com/cosmos/chain-registry/master/stride/images/strd.svg"
  },
  "isAConsumerChain": true,
  "providerChain": "cosmoshub",
  "rpcUrl": "https://stride-fleet.main.stridenet.co",
  "restUrl": "https://stride-fleet.main.stridenet.co/api",
  "chainId": "stride-1",
  "bech32": "stride",
  "denom": "strd",
  "denomUpper": "STRD",
  "sdenom": "ustrd",
  "coinType": 118,
  "gasPriceStep": {
    "low": 0.025,
    "average": 0.025,
    "high": 0.025
  },
  "gasModifier": 1.5,
  "coinDecimals": 6,
  "features": ["ibc-transfer", "ibc-go"],
  "coinGeckoId": "stride",
  "chainInfo": {
    "cosmosSdkVersion": "0.47.10",
    "ibcGoVersion": "7.3.1"
  },
  "colors": {
    "primaryOnLight": "#e91179",
    "primaryOnDark": "#e91179",
    "lighterOnLight": "#fef1f7",
    "lighterOnDark": "#fef1f7",
    "darkerOnLight": "#e91179",
    "darkerOnDark": "#e91179"
  },
  "links": [
    {
      "title": "Official Website",
      "url": "https://stride.zone",
      "icon": {
        "svg": "web"
      }
    },
    {
      "title": "Docs",
      "url": "https://docs.stride.zone",
      "icon": {
        "svg": "document"
      }
    },
    {
      "title": "GitHub",
      "url": "https://github.com/Stride-Labs/stride",
      "icon": {
        "svg": "github"
      }
    },
    {
      "title": "Learn more",
      "icon": {
        "svg": "dotsHorizontal"
      },
      "children": [
        {
          "title": "Medium",
          "url": "https://stride.zone/blog",
          "icon": {
            "svg": "medium"
          }
        },
        {
          "title": "Twitter",
          "url": "https://twitter.com/stride_zone",
          "icon": {
            "svg": "twitter"
          }
        },
        {
          "title": "Discord",
          "url": "https://stride.zone/discord",
          "icon": {
            "svg": "discord"
          }
        }
      ]
    }
  ],
  "isExplorerEnabled": true,
  "isModuleEnabled": {
    "governance": true
  },
  "isNativelySupportedByKeplr": true,
  "withCoingeckoApi": true,
  "isFeatured": true
}
