{
  "$schema": "../../chain.schema.json",
  "name": "neutron_testnet",
  "chainName": "Neutron Testnet",
  "logo_URIs": {
    "png": "https://raw.githubusercontent.com/cosmos/chain-registry/master/testnets/neutrontestnet/images/neutron-black-logo.png",
    "svg": "https://raw.githubusercontent.com/cosmos/chain-registry/master/testnets/neutrontestnet/images/neutron-black-logo.svg"
  },
  "isAConsumerChain": true,
  "providerChain": "cosmoshub_testnet",
  "rpcUrl": "https://rpc.testcosmos.directory/neutrontestnet",
  "restUrl": "https://rest.testcosmos.directory/neutrontestnet",
  "chainId": "pion-1",
  "bech32": "neutron",
  "denom": "neutron",
  "denomUpper": "NTRN",
  "sdenom": "untrn",
  "coinType": 118,
  "gasPriceStep": {
    "low": 0.025,
    "average": 0.025,
    "high": 0.025
  },
  "coinDecimals": 6,
  "features": [
    "ibc-transfer",
    "cosmwasm"
  ],
  "coinGeckoId": "",
  "assets": [
    {
      "base": "untrn",
      "coingecko_id": null,
      "denom_units": [
        {
          "denom": "ntrn",
          "exponent": 0
        },
        {
          "denom": "untrn",
          "exponent": 6
        }
      ],
      "description": "The native staking and governance token of the ntrn Network.",
      "display": "ntrn",
      "logo_URIs": {
        "png": "https://raw.githubusercontent.com/cosmos/chain-registry/master/testnets/neutrontestnet/images/neutron-black-logo.png",
        "svg": "https://raw.githubusercontent.com/cosmos/chain-registry/master/testnets/neutrontestnet/images/neutron-black-logo.svg"
      },
      "name": "NTRN",
      "symbol": "NTRN"
    }
  ],
  "chainInfo": {
    "cosmosSdkVersion": "0.45.15",
    "ibcGoVersion": "4.3.0"
  },
  "colors": {
    "primaryOnLight": "#000",
    "primaryOnDark": "#fff",
    "lighterOnLight": "#000",
    "lighterOnDark": "#fff",
    "darkerOnLight": "#43ad6b",
    "darkerOnDark": "#43ad6b"
  },
  "links": [
    {
      "title": "Official Website",
      "url": "https://neutron.org",
      "icon": {
        "svg": "web"
      }
    },
    {
      "title": "GitHub",
      "url": "https://github.com/neutron-org",
      "icon": {
        "svg": "github"
      }
    },
    {
      "title": "Twitter",
      "url": "https://twitter.com/Neutron_org",
      "icon": {
        "svg": "twitter"
      }
    },
    {
      "title": "Learn more",
      "icon": {
        "svg": "dotsHorizontal"
      },
      "children": [
        {
          "title": "Discord",
          "url": "https://discord.com/invite/zRT2ZkQsxA",
          "icon": {
            "svg": "discord"
          }
        },
        {
          "title": "Telegram",
          "url": "https://t.me/neutron_community",
          "icon": {
            "svg": "telegram"
          }
        }
      ]
    }
  ],
  "isExplorerEnabled": true,
  "isModuleEnabled": {
    "governance": true
  },
  "isNativelySupportedByKeplr": false,
  "withCoingeckoApi": false,
  "isFeatured": true
}
