{
  "$schema": "../../chain.schema.json",
  "name": "juno",
  "chainName": "Juno",
  "logo_URIs": {
    "png": "https://raw.githubusercontent.com/cosmos/chain-registry/master/juno/images/juno.png",
    "svg": "https://raw.githubusercontent.com/cosmos/chain-registry/master/juno/images/juno.svg"
  },
  "rpcUrl": "https://rpc.cosmos.directory/juno",
  "restUrl": "https://rest.cosmos.directory/juno",
  "chainId": "juno-1",
  "denom": "juno",
  "denomUpper": "JUNO",
  "sdenom": "ujuno",
  "coinType": 118,
  "gasPriceStep": {
    "low": 0.075,
    "average": 0.1,
    "high": 0.125
  },
  "gasModifier": 1.8,
  "coinDecimals": 6,
  "features": [
    "ibc-transfer",
    "ibc-go",
    "cosmwasm",
    "wasmd_0.24+"
  ],
  "coinGeckoId": "juno-network",
  "chainInfo": {
    "cosmosSdkVersion": "0.47.12",
    "ibcGoVersion": "7.3.1"
  },
  "colors": {
    "primaryOnLight": "#f0827d",
    "primaryOnDark": "#f0827d",
    "darkerOnLight": "#c5585a",
    "darkerOnDark": "#c5585a",
    "lighterOnLight": "#fdf0ef",
    "lighterOnDark": "#fdf0ef"
  },
  "links": [
    {
      "title": "Official Website",
      "url": "https://www.junonetwork.io/",
      "icon": {
        "svg": "web"
      }
    },
    {
      "title": "DApp",
      "icon": {
        "svg": "apps"
      },
      "children": [
        {
          "title": "JunoSwap",
          "url": "https://junoswap.com",
          "icon": {
            "svgImg": "dapp/junoswap"
          }
        },
        {
          "title": "DAODAO",
          "url": "https://daodao.zone/",
          "icon": {
            "svgImg": "dapp/daodao"
          }
        },
        {
          "title": "JunoMint",
          "url": "https://junomint.com/",
          "icon": {
            "svgImg": "dapp/junomint"
          }
        }
      ]
    },
    {
      "title": "Docs",
      "url": "https://docs.junonetwork.io",
      "icon": {
        "svg": "document"
      }
    },
    {
      "title": "Learn more",
      "icon": {
        "svg": "dotsHorizontal"
      },
      "children": [
        {
          "title": "GitHub",
          "url": "https://github.com/CosmosContracts",
          "icon": {
            "svg": "github"
          }
        },
        {
          "title": "Medium",
          "url": "https://medium.com/@JunoNetwork",
          "icon": {
            "svg": "medium"
          }
        },
        {
          "title": "Twitter",
          "url": "https://twitter.com/JunoNetwork",
          "icon": {
            "svg": "twitter"
          }
        }
      ]
    }
  ],
  "isExplorerEnabled": true,
  "isModuleEnabled": {
    "governance": true
  },
  "isNativelySupportedByKeplr": true,
  "withCoingeckoApi": true,
  "isFeatured": true
}
